{
  "$schema": "https://json-schema.org/draft/2020-12/schema",
  "$id": "urn:srcos:agent-machine:schema:steering-artifact-receipt:v0.1.0",
  "title": "SteeringArtifactReceipt",
  "description": "Receipt for resolved local steering model and SAE artifacts. Each artifact record requires source repo, exact file path, resolved revision, and SHA-256 digest.",
  "type": "object",
  "additionalProperties": false,
  "required": ["specVersion", "id", "kind", "sourcesetId", "status", "generatedAt", "artifactRecords", "receiptSafety"],
  "properties": {
    "specVersion": { "type": "string", "const": "0.1.0" },
    "id": { "type": "string", "pattern": "^urn:srcos:agent-machine:steering-artifact-receipt:[a-z0-9][a-z0-9.-]*$" },
    "kind": { "type": "string", "const": "SteeringArtifactReceipt" },
    "sourcesetId": { "type": "string", "pattern": "^[a-z0-9][a-z0-9.-]*$" },
    "status": { "type": "string", "enum": ["pending", "complete", "failed"] },
    "generatedAt": { "type": "string" },
    "activationIssue": { "type": "string" },
    "artifactRecords": { "type": "array", "items": { "$ref": "#/$defs/artifactRecord" }, "uniqueItems": true },
    "missing": { "type": "array", "items": { "type": "string" }, "uniqueItems": true },
    "storageReceiptRefs": { "type": "array", "items": { "type": "string" }, "uniqueItems": true },
    "policyRefs": { "type": "array", "items": { "type": "string" }, "uniqueItems": true },
    "agentRegistryGrantRefs": { "type": "array", "items": { "type": "string" }, "uniqueItems": true },
    "receiptSafety": {
      "type": "object",
      "additionalProperties": false,
      "required": ["includeRawArtifacts", "includeAuthMaterial"],
      "properties": {
        "includeRawArtifacts": { "type": "boolean", "const": false },
        "includeAuthMaterial": { "type": "boolean", "const": false }
      }
    },
    "consent": {
      "type": "object",
      "additionalProperties": false,
      "description": "The consent decision as adjudicated, and CRUCIALLY when. checkedBefore='download' asserts no byte was requested until the decision passed; a receipt that cannot make that claim should not imply it.",
      "required": [
        "required",
        "checkedBefore"
      ],
      "properties": {
        "required": {
          "type": "boolean",
          "description": "Whether the sourceset demanded consent at all."
        },
        "checkedBefore": {
          "type": "string",
          "enum": [
            "download",
            "activation"
          ],
          "description": "The point in the sequence at which consent was adjudicated. 'activation' means bytes had already landed."
        },
        "consentRef": {
          "type": [
            "string",
            "null"
          ]
        },
        "scope": {
          "type": "string",
          "enum": [
            "download",
            "activation",
            "download-and-activation"
          ]
        },
        "decidedAt": {
          "type": "string"
        },
        "subjectRef": {
          "type": "string"
        },
        "attestation": {
          "type": "string",
          "enum": [
            "interactive-operator",
            "delegated-policy",
            "automated-fleet"
          ]
        },
        "declaredBytes": {
          "type": [
            "integer",
            "null"
          ],
          "minimum": 0
        }
      }
    },
    "outstandingPolicyRequirements": {
      "type": "array",
      "items": {
        "type": "string"
      },
      "description": "Requirements the sourceset declares that resolution does NOT discharge. They gate activation, not fetching, so resolution cannot satisfy them \u2014 but naming them keeps a declared-and-unread policy block from reading as a satisfied one."
    },
    "notes": { "type": "array", "items": { "type": "string" } }
  },
  "$defs": {
    "artifactRecord": {
      "type": "object",
      "additionalProperties": false,
      "required": ["role", "source", "storage", "digest"],
      "properties": {
        "role": { "type": "string", "enum": ["model-config", "model-weight", "tokenizer", "sae-artifact", "sae-config", "other"] },
        "source": {
          "type": "object",
          "additionalProperties": false,
          "required": ["type", "repo", "filePath", "resolvedRevision"],
          "properties": {
            "type": { "type": "string", "enum": ["huggingface", "local", "other"] },
            "repo": { "type": "string" },
            "filePath": { "type": "string", "minLength": 1 },
            "resolvedRevision": { "type": "string", "minLength": 1 },
            "url": { "type": "string" }
          }
        },
        "storage": {
          "type": "object",
          "additionalProperties": false,
          "required": ["localPath", "sizeBytes"],
          "properties": {
            "localPath": { "type": "string", "minLength": 1 },
            "sizeBytes": { "type": "integer", "minimum": 0 },
            "storageReceiptRef": { "type": ["string", "null"] }
          }
        },
        "digest": {
          "type": "object",
          "additionalProperties": false,
          "description": "Records the integrity check that was actually performed, not the one that was intended. verified:true is admissible only when the observed digest was compared equal to a digest pinned in the sourceset BEFORE download, and the value compared against is carried in expectedSha256.",
          "required": ["algorithm", "sha256", "verified", "verificationMethod"],
          "properties": {
            "algorithm": { "type": "string", "const": "sha256" },
            "sha256": { "type": "string", "pattern": "^[a-f0-9]{64}$" },
            "expectedSha256": { "type": "string", "pattern": "^[a-f0-9]{64}$" },
            "verified": { "type": "boolean" },
            "verificationMethod": {
              "type": "string",
              "enum": ["pinned-digest", "trust-on-first-use", "unverified"],
              "description": "pinned-digest: observed digest compared equal to a pre-download pinned expectation. trust-on-first-use: digest computed from the bytes that just arrived, with nothing to compare against — a record of WHAT arrived, not evidence that what arrived was CORRECT. unverified: no digest computed."
            }
          },
          "allOf": [
            {
              "if": {
                "required": ["verified"],
                "properties": { "verified": { "const": true } }
              },
              "then": {
                "required": ["expectedSha256"],
                "properties": { "verificationMethod": { "const": "pinned-digest" } }
              }
            },
            {
              "if": {
                "required": ["verificationMethod"],
                "properties": { "verificationMethod": { "const": "pinned-digest" } }
              },
              "then": { "required": ["expectedSha256"] }
            }
          ]
        }
      }
    }
  }
}
