{
  "activationIssue": "active-steering-work",
  "agentRegistryGrantRefs": [],
  "artifactRecords": [
    {
      "digest": {
        "algorithm": "sha256",
        "expectedSha256": "e127f6c93d77b6e8d5ce59f9e98996484486bdbbe6d85cc2fccb1115e8c79bb0",
        "sha256": "e127f6c93d77b6e8d5ce59f9e98996484486bdbbe6d85cc2fccb1115e8c79bb0",
        "verificationMethod": "pinned-digest",
        "verified": true
      },
      "role": "model-weight",
      "source": {
        "filePath": "synthetic-model.txt",
        "repo": "synthetic/model",
        "resolvedRevision": "synthetic-fixture",
        "type": "local",
        "url": "local://examples/fixtures/steering-loader/synthetic-model.txt"
      },
      "storage": {
        "localPath": "examples/fixtures/steering-loader/synthetic-model.txt",
        "sizeBytes": 25,
        "storageReceiptRef": null
      }
    },
    {
      "digest": {
        "algorithm": "sha256",
        "expectedSha256": "a758389c63a7db69e811c4f26a4834e02a1630b2b29c08bdca5db49627d91415",
        "sha256": "a758389c63a7db69e811c4f26a4834e02a1630b2b29c08bdca5db49627d91415",
        "verificationMethod": "pinned-digest",
        "verified": true
      },
      "role": "sae-artifact",
      "source": {
        "filePath": "synthetic-sae.txt",
        "repo": "synthetic/sae",
        "resolvedRevision": "synthetic-fixture",
        "type": "local",
        "url": "local://examples/fixtures/steering-loader/synthetic-sae.txt"
      },
      "storage": {
        "localPath": "examples/fixtures/steering-loader/synthetic-sae.txt",
        "sizeBytes": 23,
        "storageReceiptRef": null
      }
    }
  ],
  "generatedAt": "1970-01-01T00:00:00Z",
  "id": "urn:srcos:agent-machine:steering-artifact-receipt:synthetic.available",
  "kind": "SteeringArtifactReceipt",
  "missing": [],
  "notes": [
    "Synthetic fixture for CI-only loader validation.",
    "This fixture proves digest re-verification and load-path gating without model weights."
  ],
  "policyRefs": [],
  "receiptSafety": {
    "includeAuthMaterial": false,
    "includeRawArtifacts": false
  },
  "sourcesetId": "synthetic.available",
  "specVersion": "0.1.0",
  "status": "complete",
  "storageReceiptRefs": []
}
