{
  "activationIssue": "active-steering-work",
  "agentRegistryGrantRefs": [],
  "artifactRecords": [
    {
      "digest": {
        "algorithm": "sha256",
        "sha256": "0000000000000000000000000000000000000000000000000000000000000000",
        "verificationMethod": "trust-on-first-use",
        "verified": false
      },
      "role": "model-config",
      "source": {
        "filePath": "config.json",
        "repo": "openai-community/gpt2",
        "resolvedRevision": "0000000000000000000000000000000000000000",
        "type": "huggingface",
        "url": "https://huggingface.co/openai-community/gpt2/blob/0000000000000000000000000000000000000000/config.json"
      },
      "storage": {
        "localPath": "/tmp/agent-machine-nonexistent/gpt2/config.json",
        "sizeBytes": 0,
        "storageReceiptRef": null
      }
    },
    {
      "digest": {
        "algorithm": "sha256",
        "sha256": "1111111111111111111111111111111111111111111111111111111111111111",
        "verificationMethod": "trust-on-first-use",
        "verified": false
      },
      "role": "sae-artifact",
      "source": {
        "filePath": "blocks.6.hook_resid_pre/sae_weights.safetensors",
        "repo": "jbloom/GPT2-Small-SAEs-Reformatted",
        "resolvedRevision": "0000000000000000000000000000000000000000",
        "type": "huggingface",
        "url": "https://huggingface.co/jbloom/GPT2-Small-SAEs-Reformatted/blob/0000000000000000000000000000000000000000/blocks.6.hook_resid_pre/sae_weights.safetensors"
      },
      "storage": {
        "localPath": "/tmp/agent-machine-nonexistent/gpt2-sae/sae_weights.safetensors",
        "sizeBytes": 0,
        "storageReceiptRef": null
      }
    }
  ],
  "generatedAt": "1970-01-01T00:00:00Z",
  "id": "urn:srcos:agent-machine:steering-artifact-receipt:gpt2-small.res-jb.missing-fixture",
  "kind": "SteeringArtifactReceipt",
  "missing": [],
  "notes": [
    "Fixture for fail-closed loader validation only.",
    "Paths intentionally do not exist. The loader preflight must report not_configured rather than using artifacts."
  ],
  "policyRefs": [],
  "receiptSafety": {
    "includeAuthMaterial": false,
    "includeRawArtifacts": false
  },
  "sourcesetId": "gpt2-small.res-jb",
  "specVersion": "0.1.0",
  "status": "complete",
  "storageReceiptRefs": []
}
